{
  "schema_version": "1",
  "submission_id": "{{SUBMISSION_ID}}",
  "submitted_at": "2026-10-04T10:00:00Z",
  "name": "Riley Carter",
  "email": "t11-{{RUN_ID}}@example.com",
  "company": "Carter Logistics",
  "website": "",
  "service": "web_design",
  "budget": "5k_10k",
  "timeline": "1_3_months",
  "message": "We need a new website for our logistics company. We need a new website for our logistics company. We need a new website for our logistics company. We need a new website for our logistics company. We need a new website for our logistics company. We need a new website for our logistics company. We need a new website for our logistics company. We need a new website for our logistics company. We need a new website for our logistics company. We need a new website for our logistics company. We need a new website for our logistics company. We need a new website for our logistics company. We need a new website for our logistics company. We need a new website for our logistics company. We need a new website for our logistics company. We need a new website for our logistics company. We need a new website for our logistics company. We need a new website for our logistics company. We need a new website for our logistics company. We need a new website for our logistics company. We need a new website for our logistics company. We need a new website for our logistics company. We need a new website for our logistics company. We need a new website for our logistics company. We need a new website for our logistics company. We need a new website for our logistics company. We need a new website for our logistics company. We need a new website for our logistics company. We need a new website for our logistics company. We need a new website for our logistics company. We need a new website for our logistics company. We need a new website for our logistics company. We need a new website for our logistics company. We need a new website for our logistics company. We need a new website for our logistics company. We need a new website for our logistics company. We need a new website for our logistics company. We need a new website for our logistics company. We need a new website for our logistics company. We need a new website for our logistics company. We need a new website for our logistics company. We need a new website for our logistics company.",
  "consent": true,
  "fax_number": "",
  "fill_time_ms": 72000
}
