{
  "schema_version": "1",
  "submission_id": "{{SUBMISSION_ID}}",
  "submitted_at": "2026-10-04T10:00:00Z",
  "name": "Chris Walsh",
  "email": "{{TEST_EMAIL+s1}}",
  "company": "Walsh Plumbing",
  "website": "walshplumbing.example",
  "service": "seo",
  "budget": "2k_5k",
  "timeline": "1_3_months",
  "message": "Plumbing firm in south Manchester wanting more Google calls for boiler repairs, plus help getting reviews on our profile.",
  "consent": true,
  "fax_number": "",
  "fill_time_ms": 44700
}
